{
  "grantId": "grant-0001",
  "scope": "session_operation",
  "principalId": "principal-123",
  "sessionId": "session-123",
  "actionDigest": "aaaaaaaaaaaaaaaaaaaaaaaaaaaaaaaaaaaaaaaaaaaaaaaaaaaaaaaaaaaaaaaa",
  "scopeDigest": "bbbbbbbbbbbbbbbbbbbbbbbbbbbbbbbbbbbbbbbbbbbbbbbbbbbbbbbbbbbbbbbb",
  "policyDigest": "policy-v8-example",
  "tool": "set_value",
  "operation": "set_value",
  "actionClass": "edit_reversible",
  "mode": "foreground",
  "issuedAt": "2026-07-13T12:00:00.000Z",
  "expiresAt": "2026-07-13T12:02:00.000Z",
  "remainingUses": 10,
  "consumedByActionIds": []
}
